<?xml version="1.0" encoding="utf-8" ?>
<!DOCTYPE SCD[
	<!ELEMENT SCD (Screen*, CmnTransition*)>	
	<!ELEMENT Screen (Transition*)>
	<!ELEMENT Transition EMPTY>
	<!ELEMENT CmnTransition EMPTY>
	<!ATTLIST Screen
		value CDATA #REQUIRED
		directLink (allow|deny) "allow">
	<!ATTLIST Transition
		value CDATA #REQUIRED
		label CDATA #REQUIRED
		mode  (T|R) #IMPLIED>
	<!ATTLIST CmnTransition
		value CDATA #REQUIRED
		label ID #REQUIRED
		mode  (T|R) #IMPLIED>
]>
<!-- Screenタグの現画面の仮想パスはIDにできるが、
「/」を含むため、XMLのIDとしては利用できない。 -->
<SCD>
	<Screen value="~/Aspx/start/login.aspx" directLink="allow">
		<Transition value="~/Aspx/start/menu.aspx" label="menu"/>
	</Screen>
	<Screen value="~/Aspx/start/menu.aspx" directLink="allow">
	</Screen>
	<Screen value="~/Aspx/testScreenCtrl/WebForm0.aspx" directLink="allow">
		<Transition value="~/Aspx/testScreenCtrl/WebForm1.aspx" label="0→1"/>
		<Transition value="~/Aspx/testScreenCtrl/WebForm2.aspx" label="0→2"/>
		<Transition value="~/Aspx/testScreenCtrl/WebForm3.aspx" label="0→3"/>
		<Transition value="~/Aspx/testScreenCtrl/WebForm4.aspx" label="0→4"/>
		<Transition value="~/Aspx/testScreenCtrl/WebForm5.aspx" label="0→5"/>
	</Screen>
	<Screen value="~/Aspx/testScreenCtrl/WebForm1.aspx" directLink="deny">
		<Transition value="~/Aspx/testScreenCtrl/WebForm2.aspx" label="1→2"/>
	</Screen>
	<Screen value="~/Aspx/testScreenCtrl/WebForm2.aspx" directLink="deny">
		<Transition value="~/Aspx/testScreenCtrl/WebForm3.aspx" label="2→3"/>
	</Screen>
	<Screen value="~/Aspx/testScreenCtrl/WebForm3.aspx" directLink="allow">
		<Transition value="~/Aspx/testScreenCtrl/WebForm4.aspx" label="3→4"/>
	</Screen>
	<Screen value="~/Aspx/testScreenCtrl/WebForm4.aspx" directLink="deny">
		<Transition value="~/Aspx/testScreenCtrl/WebForm1.aspx" label="4→1"/>
		<Transition value="~/Aspx/testScreenCtrl/WebForm5.aspx" label="4→5"/>
	</Screen>
	<Screen value="~/Aspx/testScreenCtrl/WebForm5.aspx" directLink="deny">
		<Transition value="~/Aspx/testScreenCtrl/WebForm1.aspx" label="5→1"/>
		<Transition value="~/Aspx/testScreenCtrl/WebForm2.aspx" label="5→2"/>
		<Transition value="~/Aspx/testScreenCtrl/WebForm3.aspx" label="5→3"/>
		<Transition value="~/Aspx/testScreenCtrl/WebForm4.aspx" label="5→4"/>
	</Screen>
	<CmnTransition value="~/Aspx/testScreenCtrl/WebForm0.aspx" label="WebForm0"/>
	<CmnTransition value="~/Aspx/testScreenCtrl/WebForm1.aspx" label="WebForm1"/>
	<CmnTransition value="~/Aspx/testScreenCtrl/WebForm2.aspx" label="WebForm2"/>
	<CmnTransition value="~/Aspx/testScreenCtrl/WebForm3.aspx" label="WebForm3"/>
	<CmnTransition value="~/Aspx/testScreenCtrl/WebForm4.aspx" label="WebForm4"/>
	<CmnTransition value="~/Aspx/testScreenCtrl/WebForm5.aspx" label="WebForm5"/>
	<CmnTransition value="http://www.google.co.jp/search?sourceid=navclient-ff&amp;ie=UTF-8&amp;rlz=1B3GGGL_jaJP268JP268&amp;aq=t" label="google"/>
</SCD>